{
  "events": [
    "장서각 붕괴 사고 직후 결맥을 읽는 눈 각성 (B01 전사)",
    "계승비무 직전 장로 검식 복원 — 판세 역전 — 장로 공개 보호 (B01)",
    "장서각 임시 열쇠 획득 — 봉인 비고 진입 — 두 번째 비급 결맥 발견 (B02)",
    "경쟁 문파 청풍검파 위서 비급 사기 간파 — 내문 진입권 회수 (B03)",
    "내문 수석 설화진의 정치 공세 — 장서각 열쇠 반납 요구 (B10)",
    "첫 복원 실패 — 제자 경맥 손상 — 자신감 급락 (B13)",
    "청풍검파 위서 공격 — 태허검문 비급 위서 주장 — 정통성 위기 (B20)",
    "곽유정이 장서각 일부 봉인 — 접근권 박탈 (B28)",
    "설화진이 곽유정의 명으로 비급 조작 사실 폭로 — 문파 분열 (B35)",
    "사공묵과 곽유정 연결 폭로 — 흑시 비급 시장 혼란 (B40)",
    "대교란 진실 전모 폭로 — 곽유정 도주 — 강호 비급 신뢰 위기 (B45)",
    "여운의 붉은 흔적 약화 — 복원 능력 상실 위기 (B53)",
    "곽유정 역습 — 진본 비급으로 무장한 세력 반격 (B58)",
    "창파 진본 비급 복원 실패 — 경맥 파열 (B63)",
    "복원 감각 최종 돌파 — 서맥 창조 경지 (B65)",
    "최종전 — 곽유정의 대교란 체계 해체 — 강호 정통성 재정립 (B69)",
    "문파의 살아 있는 기준점으로 — 비급 체계 전수 (B70)"
  ],
  "npc_candidates": [
    "한설 — 장로, 첫 복원 대상, 보호자. (B01~B70)",
    "설화진 — 내문 수석, 정치적 경쟁자. (B02~B35, 이후 중립→비극적 퇴장)",
    "도연화 — 내문 여제자, 약초 지식, 초기 조력자, 연인 라인. (B03~B70)",
    "풍잔운 — 청풍검파 부장문, 위서 조직 2차 적대자. (B12~B40)",
    "사공묵 — 흑시 비급 중개인, 곽유정의 도구. (B18~B50)",
    "곽유정 — 원로원장, 30년 대교란 설계자, 최종 흑막. (B05~B65)",
    "백사검 — 현 장문인, 노쇠, 계승 갈등. (B01~B50)",
    "묵리 — 떠돌이 비급 수집가, 대교란 피해자. (B10~B60)",
    "허무영 — 봉인각 관리인, 곽유정 과거의 증인. (B15~B55)",
    "이청하 — 남궁세가 장서각 서기, 외부 교류 창구. (B20~B60)"
  ],
  "crisis_candidates": [
    "장서각 열쇠 반납 요구 — 정치적 압력 (B10)",
    "복원 실패 — 제자 경맥 손상 (B13)",
    "위서 공격 — 문파 정통성 위기 (B20)",
    "장서각 봉인 — 접근권 박탈 (B28)",
    "설화진 조작 폭로 — 문파 분열 (B35)",
    "사공묵 배반 — 비급 시장 혼란 (B40)",
    "대교란 폭로 — 강호 신뢰 위기 (B45)",
    "붉은 흔적 약화 — 복원 능력 상실 (B53)",
    "곽유정 역습 — 진본 무장 세력 (B58)",
    "창파 복원 실패 — 경맥 파열 (B63)"
  ],
  "terms": [
    "결맥(結脈): 비급 속에서 끊기거나 잘못 옮겨진 경맥 연결",
    "붉은 흔적: 여운이 보는 결맥의 시각적 표현. 끊긴 경맥이 붉게 빛남",
    "비급 대교란(大攪亂): 30년 전 곽유정의 의도적 비급 변조 사건",
    "침점법(針點法): 여운의 전투 체계. 경맥 약점을 정확히 찌르는 정밀 무공",
    "장서각: 문파의 비급 보관소. 외문 비고→내문 비고→봉인각→원로원 금고 위계",
    "계승비무: 문파 간 또는 문파 내 정통성을 걸고 벌이는 의례적 비무",
    "위서(僞書): 가짜 비급. 고의로 변조하거나 오기가 누적된 사본",
    "정통성 판정: 비급의 진위를 검증해 문파의 강호 정통성을 인증하는 행위",
    "복원 감각 7단계: 결맥 식별→통맥 독해→경맥 재구성→활맥 통찰→정맥 판정→조맥 재편→서맥 창조",
    "보호채무: 복원 대가로 장로가 여운에게 지는 빚. 보호와 접근권으로 상환"
  ],
  "scene_details": [
    "복원 5단계 시퀀스: 결맥 탐지(비급 위의 붉은 흔적 읽기)→원본 대조(다른 사본·경혈 문헌 비교)→운기 재구성(끊긴 순서를 논리적으로 연결)→대리 시연(장로/제자에게 복원 순서 전달, 실전 구동)→공개 증명(비무/시연에서 복원 무공 작동 확인)",
    "계승비무 장면: 문파의 존립을 걸고 벌이는 의례 비무. 정해진 검식으로 승부하므로 검식의 완성도가 곧 승패",
    "위서 판별 장면: 여운이 두 문파의 비급을 나란히 놓고 결맥의 차이를 읽어 내며 어느 쪽이 진본인지 판정. 강호 전체가 지켜보는 공개 판정",
    "장서각 탐색 장면: 먼지 쌓인 비고에 들어가 필사본을 한 장씩 넘기며 붉은 흔적을 찾는 장면. 복원 작업의 고유한 분위기",
    "침점법 전투 장면: 상대의 검세/권법에서 결맥을 실시간으로 읽고, 경맥의 약점을 정확히 찌르는 최소 동작 전투. 강하지 않지만 정확한 무공"
  ],
  "notes": "canon pitch(2026-04-06) PASS 기반 intake. 적대자 4단계(문파 내부→경쟁 문파/위서→비급 정치→최종 흑막), NPC 10인, 위기 10개, 복선 7개 이상 설계 완료. Phase 0에 바로 투입 가능."
}
