{
  "events": [
    "문하 생활관 폐점 결재 임박 — Block 1 오프닝, 후계 경쟁에서 빠지고 싶은 서준이 일부러 좌천처럼 내려간 첫 현장. 폐점 보고서의 `상권 사망` 숫자와 실제 점심 유동이 어긋남",
    "하루짜리 운영 실험 — Block 2-3, 측면 출입구 재개방 + 병원 셔틀 시간대 도시락/약국 동선 연계 + 푸드코트 좌석 재배치로 당일 점심 매출 반전, 폐점 결재 30일 보류 + 현장 운영대행 직함",
    "지역본부 판촉비 누수 노출 — Block 4-5, 긴급 MD 교체권 + 소액 예산 인장 + 본사 직보 주간 보고선 진입",
    "권역 파일럿 검토권 확보 — Block 6, 한 점포 살린 방식이 권역 파일럿 검토안으로 올라가며 다음 전장 입장권 발생",
    "권역 단위 운영 파일럿 진입 — ARC-02, 첫 권역 단위 책임, 다른 점포로 같은 회생 패턴 적용",
    "그룹 자본배분 회의 첫 발언 — ARC-03 후반, 권역 운영 데이터로 사업부 자본배분 발언권 진입",
    "원자재·환율 쇼크 — ARC-04 트리거, 형의 라운드. 형이 손절·자산 정리·차입 재편으로 그룹을 지켜낸다. 서준은 자기 권역 안에서 보조 역할만",
    "대형 리브랜딩 / 해외 합작 — ARC-05 트리거, 누나의 라운드. 누나가 여론·규제·노조 협상으로 판을 살린다. 서준은 현장 데이터 공급",
    "현금흐름 공백 — ARC-06 트리거, 형이 지킨 뒤·누나가 연 뒤에도 돈이 안 도는 공백. 서준이 죽은 점포·조달선·물류망을 이어 붙여 현금흐름을 살린다 (서준 라운드)",
    "글로벌 생활산업 제국 설계 — ARC-07, 세 축 결합 파이널. 형/누나가 서준을 인정한 상태에서 서준이 자기 재생·확장 축을 형의 생존·누나의 대외전 위에 쌓아 올린다"
  ],
  "npc_candidates": [
    "강서준(28) — 주인공, 대륜그룹 막내, 후계 회피형, 시그니처 축 = 죽은 사업의 재생과 확장",
    "강도윤(35) — 형, 시그니처 축 = 생존과 안정. ARC-04 라운드 주인공. 동생을 뒤에서 챙기는 타입",
    "강민서(32) — 누나, 시그니처 축 = 브랜드와 대외전. ARC-05 라운드 주인공. 협상가",
    "대륜그룹 회장(부친, 실명 미정) — 후계 판정자, ARC-04부터 본격 등장",
    "지역본부장(실명 미정) — ARC-01~02 첫 적대축, 판촉비 누수와 리베이트 직접 관리자, 바보 악역 금지",
    "문하 생활관 점장(실명 미정) — 첫 현장 협력자, 권역 확장 시 첫 권역장 후보",
    "본사 기획실장(실명 미정) — 본사 직보 라인 매개자, ARC-01 후반 등장",
    "그룹 재무팀장(실명 미정) — ARC-03~04 그룹 자본배분 게이트키퍼",
    "해외 조달 파트너(실명 미정) — ARC-06~07 글로벌 라운드 첫 협상 상대"
  ],
  "crisis_candidates": [
    "문하 생활관 폐점 결재 (Block 1 spike)",
    "지역본부 판촉비 누수 / MD 리베이트 노출",
    "권역 파일럿 확장 vs 지역본부 저항",
    "원자재·환율 쇼크 (형의 라운드)",
    "대형 리브랜딩·해외 합작의 여론·규제·노조 동시 압력 (누나의 라운드)",
    "형이 지킨 뒤·누나가 연 뒤의 현금흐름 공백 (서준의 라운드)",
    "세 축 결합 파이널 — 글로벌 생활산업 제국 설계 경쟁"
  ],
  "terms": [
    "운영대행 직함: 정식 발령 전 단계의 현장 책임 권한, 본사 직보선과 묶일 때 실권화",
    "MD 교체권: 매장 내 MD(상품기획자) 교체 권한, 리베이트 누수 차단의 직접 수단",
    "임대 재협상권: 테넌트별 임대료/임대조건 재협상 권한, 점포 회생의 핵심 레버",
    "예산 인장: 본인 명의로 집행 가능한 예산 한도 (소액 -> 권역 -> 사업부 -> 그룹 자본배분 발언권)",
    "본사 직보 주간 보고선: 지역본부를 우회해 본사에 직접 주간 보고하는 라인, 평가 권한 변화의 신호",
    "권역 파일럿: 한 점포 성공 패턴을 권역 단위로 확장하는 시범 운영권",
    "그룹 자본배분 발언권: 사업부 간 자본배분과 차입 구조 재조정에 참여하는 권한, 후계 후보 공식화의 분수령",
    "조달선 조정권: 국내 조달선 변경 권한, 해외 소싱 파일럿으로 확장됨",
    "POS 시간대 매출: 시간대별 매출 데이터, 동선·영업시간·테넌트 배치 판단의 1차 근거",
    "푸드코트 회전율: 좌석당 회전 횟수, 점심 시간대 매출과 직결",
    "판촉비 누수: 본사 판촉비가 지역본부·특정 MD로 새는 패턴, 본사 보고에 잡히지 않음"
  ],
  "scene_details": [
    "문하 생활관 첫 현장 순회: 닫혀 있는 측면 출입구, 엉망인 푸드코트 좌석 회전, 병원 셔틀 동선과 안 맞는 영업시간, 지역본부 판촉비 누수를 한 번에 읽는 장면",
    "폐점 회의 직전 하루짜리 운영 실험: 측면 출입구 재개방, 병원 셔틀 시간대 맞춤 도시락/약국 동선 연계, 푸드코트 좌석 재배치로 당일 점심 매출 반전",
    "본사 직보 첫 주간 보고: 지역본부장을 우회해 본사 기획실장에게 직접 보고서를 올리는 장면, 평가 권한 변화의 첫 가시화",
    "권역 단위 운영 파일럿 회의: 첫 권역장과의 협력 / 갈등, 같은 회생 패턴이 다른 점포에서 어떻게 변형되는지 검증",
    "그룹 자본배분 회의 첫 배석: 형·누나·재무팀장 사이에 서준이 처음으로 발언권을 갖고 앉는 장면",
    "원자재·환율 쇼크 비상 대책 회의: 형의 라운드, 형이 손절·자산 정리·차입 재편을 주도하고 서준은 자기 권역 안에서 보조 데이터만 제공",
    "대형 리브랜딩 협상 테이블: 누나의 라운드, 여론·규제·노조 동시 압력 속에서 누나가 판을 움직이고 서준은 현장 데이터 공급",
    "현금흐름 공백 진단 회의: 서준이 형/누나가 만들어 둔 토대 위에서 죽은 점포·조달선·물류망을 다시 이어 붙이는 구조도를 펼치는 장면",
    "글로벌 소싱 파트너 첫 협상: 후반 글로벌 라운드의 첫 해외 파트너 협상",
    "세 축 결합 파이널 회의: 형·누나·서준이 각자 축의 승리를 인정한 상태에서 누가 그룹 전체를 묶을지 결정되는 장면"
  ],
  "notes": "캐논 락이 매우 강한 작업이라 Phase0 설계 자유도가 좁다. 4단 내면 계단(쉬고 싶다->계속 성공한다->책임감+경영의 재미->의미 창출+승부욕)과 후계 라운드 순서(형->누나->서준->파이널), 축 비침범 규칙이 모든 ARC 설계의 골격을 결정한다. ARC-01~03은 서준이 자기 축 안에서 권한을 쌓는 단계, ARC-04는 형의 라운드(서준은 보조), ARC-05는 누나의 라운드(서준은 데이터 공급), ARC-06이 서준의 라운드(형·누나가 만든 토대 위에서 현금흐름 회복), ARC-07이 세 축 결합 파이널. 비어 있는 디테일(그룹명·도시명·실명·구체 사건)은 Phase0 설계 중 확정 가능. 그룹 자본배분 메커니즘과 글로벌 조달 디테일은 상상으로 때우면 안 됨 — TR 진입 전 추가 조사 필요."
}
