{
  "events": [
    "1997년 11월 비상자산 매각 회의: 세강그룹은 유동성 확보를 위해 남서 냉장창고, 전산실 회선 계약, 부실채권 묶음을 동시에 정리하려 한다.",
    "남서 냉장창고 매각 보류: 태준이 냉장 인증 유지 비용과 입찰 자격 column을 분리해 적자 창고를 권리 자산으로 재분류한다.",
    "PC방/초고속 회선 계약 해지 보류: 전산실이 비용 절감으로 해지하려던 회선 장기계약이 게임 유통권과 결제망의 입구임을 포착한다.",
    "30일 권리 실사권: 태준은 전면 경영권이 아니라 냉장창고와 회선 계약의 권리 실사권을 요구한다.",
    "PCS 컨소시엄 표지: 회선권 검토 중 지역 대리점망과 단말 할부채권이 통신 아크로 이어진다.",
    "NPL/워크아웃 진입: IMF 유동성 위기에서 부실채권을 현금 할인 대상이 아니라 담보권/우선매수권 묶음으로 본다.",
    "반도체 부품소재 회수: 폐업 직전 하청사의 납품 인증과 공정 know-how를 보존한다.",
    "도심 호텔/오피스 권리 전환: 낡은 호텔을 시세차익이 아니라 전력/통신/냉각/도심 입지 권리로 본다.",
    "엔터/IP 유통권 묶음: 광고 inventory, 음악/게임 유통권, 편성권을 그룹 미디어/플랫폼 gate로 묶는다.",
    "지주회사 재편: 섹터별 보류권과 우선권을 하나의 권리 holding structure로 묶어 태준이 사장단 안건권을 장악한다."
  ],
  "npc_candidates": [
    "강태준 — 주인공, 회귀 전 세강그룹 잔여자산 정리 담당자, 회귀 후 권리 회수자",
    "강문식 — 세강그룹 창업주 회장, authority witness",
    "최도겸 — CFO, 현금 유동성 우선의 합리적 반대자",
    "윤세라 — 세강물류 회계 과장, 원장/계약서 proof carrier",
    "박기웅 — 전산실 통신계약 담당자, 회선/PC방 부 사건 helper",
    "권오찬 — 남서 냉장창고 현장소장, 인증/숙련 shift witness",
    "동진은행 구조조정팀장 — NPL/워크아웃 외부 gatekeeper",
    "세강전자 부품공장장 — 반도체 부품소재 witness",
    "세강호텔 자산관리팀장 — 도심 부동산/전력계약 witness",
    "광고대행사 영업본부장 — 엔터/IP/광고 inventory gatekeeper"
  ],
  "crisis_candidates": [
    "IMF 유동성 압박으로 CFO가 미래 권리를 현금화하려 한다.",
    "남서 냉장창고는 적자로 보이지만 매각하면 콜드체인 입찰 자격과 숙련 shift를 잃는다.",
    "전산실 회선 장기계약은 손해 계약처럼 보이지만 PC방/게임 유통망의 입구다.",
    "PCS 보증금 부담 때문에 컨소시엄 참여권이 버려질 위기다.",
    "부실채권 매각은 현금 확보처럼 보이지만 담보권과 우선매수권을 외국계에 넘기는 선택이다.",
    "반도체 하청사 폐업은 부채 정리처럼 보이지만 납품 인증과 공정 know-how 상실이다.",
    "호텔 매각은 유동성 확보처럼 보이지만 도심 전력/통신/냉각 권리 상실이다.",
    "엔터/IP 매각은 비핵심 정리처럼 보이지만 플랫폼 유통권 상실이다."
  ],
  "terms": [
    "권리 실사권: 매각/해지/폐쇄 전에 원본 계약과 권리 잔존 가치를 검토할 권한",
    "콜드체인 입찰 자격: 냉장 인증, 납품 이력, 시설 조건으로 다음 유통 입찰에 들어갈 수 있는 권리",
    "회선 장기계약: 비용처럼 보이나 PC방, 초고속인터넷, 결제망, 게임 유통의 초기 자원",
    "NPL 담보권: 부실채권 안에 남아 있는 담보, 전환, 우선매수 권리",
    "납품 인증: 반도체 부품소재 회사가 대기업 공급망에 들어갈 수 있는 자격",
    "전력/통신/냉각 권리: 훗날 데이터센터/서버룸/IDC로 전환 가능한 도심 인프라 권리",
    "권한 영수증: proof 뒤에 실제로 떨어지는 접근권, 보류권, 실사권, 협상권, TF owner"
  ],
  "scene_details": [
    "강문식 회장이 남서 냉장창고 매각안에 서명하려는 순간 태준이 원본 손익표의 빠진 column을 요구한다.",
    "최도겸 CFO가 현금흐름표를 앞세워 태준을 압박하지만, 태준은 매각 보류 대신 30일 권리 실사권이라는 더 작은 요구를 건다.",
    "윤세라가 냉장 인증 유지 비용이 손실이 아니라 입찰 자격 유지 비용임을 원장으로 검증한다.",
    "박기웅이 해지 예정 회선 계약서 별첨에서 PC방 회선 우선 공급권과 게임 유통권 문구를 찾아낸다.",
    "권오찬 현장소장이 냉장창고 숙련 shift와 온도 이탈 기록의 의미를 증언한다.",
    "태준이 `창고를 사자는 게 아닙니다. 창고에 붙은 권리를 사자는 겁니다`라고 말한다.",
    "첫 회의 끝에 매각과 회선 해지가 동시에 보류되고, 태준은 30일 권리 실사권을 받는다."
  ],
  "notes": "Stage0 material is sufficient for Phase0. The opening battlefield must not stay single-sector. The main event is cold-chain rights, and the mandatory side event is telecom/PC-room rights. The protagonist must remain self-interested: every protective choice must return access, options, data, rights, or control.",
  "opening_bundle_contract": {
    "bundle_window": "TR 2~6",
    "macro_battlefield": "세강그룹 비상자산 매각 회의에서 남서 냉장창고 권리와 PC방/회선권을 동시에 보류시키는 opening rights battlefield",
    "macro_battlefield_map": [
      "B2 냉장창고 매각안의 빠진 column과 회선 계약 해지 목록을 동시에 호출",
      "B3 콜드체인 입찰 자격과 회선 장기계약의 권리 가치를 분리",
      "B4 30일 권리 실사권과 전산실 계약 해지 보류권 확보",
      "B5 원장/계약서/현장 proof로 숙련 shift와 회선권을 권리 목록에 등재",
      "B6 매각 보류가 공식화되고 PC방/게임 유통권 다음 gate가 열린다"
    ],
    "bundle_goal": "태준을 IMF 현금 압박 속에서도 버려진 권리를 먼저 보는 자기중심적 후계자로 재평가시키고, 첫 opening bundle 안에서 냉장물류와 회선/PC방 두 사건을 실제 권한으로 열어 둔다.",
    "first_signboard_block": 2,
    "representative_reevaluation_block": 3,
    "next_battlefield_ticket_block": 6,
    "timing_reconciliation_note": "각 TR block은 2~6화 episode-bundle로 확장된다. 따라서 TR 1부터도 주 사건과 부 사건을 모두 포함하고, TR 2~6 opening window에서는 매 블록 권한 영수증을 지급한다."
  }
}
