{
  "events": [
    "한국에서 동아프리카 농업 인프라 사업안을 비웃음당한 강도윤이 카상가 공화국 루곤도로 복귀해 폐 NGO 시범농장을 장기임차한다",
    "첫날 밤 총상 입은 모세 카반다를 살려내고 마칼리 라인의 30일 비개입 유예와 첫 장비 반입 안전구역을 확보한다",
    "조셉 오켈로와 함께 dead well을 복구하고 태양광 펌프를 돌려 첫 물을 만든다",
    "남는 물과 못난이 작물을 시장 바닥에 꾸준히 풀어 짐꾼, 노점상, 아이들, 아미나 바시르를 잇는 생활 정보망을 만든다",
    "그레이스 나무소케 라인을 통해 병원·호텔·컴파운드에 첫 시험 납품을 성공시키고 제도권 현금흐름을 연다",
    "육묘장과 등급별 수매표를 열어 첫 소농 계약재배 묶음을 확보하고 시장·운송 전장으로 넘어간다",
    "피터 루갈라 영입, 냉장창고, 토지·우물 권리 분쟁, 급수표, 경찰 협력을 묶어 루곤도가 굴러가기 시작한다",
    "우물 조례, 학교 급식 계약, 시장 재편, 첫 시의회 개입을 거치며 도윤은 농장주가 아니라 도시 운영자로 읽히기 시작한다",
    "나탈리 세켈레 합류, 항만 시험 수출선, 개발금융, 권역 수매망을 통해 루곤도 밖 권역 단위 영향력으로 확장한다",
    "중앙 감사, 비상공급, 농업채권, 특구, 국가 장부, 장관 라인, 부재의 비용을 거쳐 도윤 시스템이 국가가 먼저 찾는 기본값이 된다"
  ],
  "npc_candidates": [
    "강도윤 — 주인공, 물과 장부를 함께 읽는 전직 파병 공병 장교",
    "모세 카반다 — 적대 축 내부에서 도윤에게 가장 먼저 빚을 지는 현장 간부",
    "조셉 오켈로 — dead well을 first working asset으로 바꾸는 기술자",
    "아미나 바시르 — 시장 바닥 정보망의 중심이자 시장 구조 재편의 핵심 현지 파트너",
    "그레이스 나무소케 — 병원·호텔·컴파운드 공급선을 여는 구매 담당",
    "다니엘 마칼리 — 보안·운송·시장관리 얼굴을 한 기업형 범죄 네트워크 대표",
    "피터 루갈라 — 장부, 수매표, 조달표, 세금표를 시스템으로 만드는 재무·통계형 인재",
    "에스더 음웬바 — 우물 조례, 토지, 허가, 시의회 전장을 여는 정치 파트너",
    "사무엘 은곤고 — 절도, 창고, 야간 치안, 보안 카르텔을 정리하는 경찰 파트너",
    "벤자민 카토 — 시청 비서실 내부 정보와 행정 속도를 연결하는 실무자",
    "나탈리 세켈레 — 국제기구, 원조사업, 투자자 라인을 연결하는 디아스포라 엘리트"
  ],
  "crisis_candidates": [
    "dead well + outsider 프레임 + 장비 반입 차단 + 야간 절도 리스크가 한꺼번에 걸린 opening 생존 위기",
    "시장 바닥에서 outsider가 첫 신뢰를 만드는 과정에서 생기는 보호비, 불신, 정보 단절 위기",
    "첫 제도권 납품 전까지의 현금흐름 공백과 제도권 구매 라인 불신",
    "수매표 공개 후 마칼리의 운송 압박, 시장 상인회 반발, 기사 빼가기, 연료 장난",
    "토지·우물 권리 분쟁, 허가 장사, 세금 장난, 학교 급식 계약을 둘러싼 도시 행정 마찰",
    "주지사 개입, 개발금융 조건표, 항만 수출선, 냉장·가공 설비, 농업채권을 둘러싼 scale transition 위기",
    "도윤 시스템이 특정 영웅의 선의가 아니라 부재의 비용이 큰 제도로 남아야 한다는 후반 구조 위기"
  ],
  "terms": [
    "dead well: 죽은 관정. 펌프·배관·권리까지 묶여 있어 복구하면 바로 power asset이 되는 우물",
    "급수표: 물 사용 시간, 우선순위, 비용, 유지 책임을 묶은 운영 표",
    "육묘장: 소농에게 모종과 재배 표준을 함께 파는 nursery 기반 시설",
    "등급별 수매표: 품질 기준과 공개 가격표. 소농 이탈과 시장 표준화를 동시에 만든다",
    "냉장수매: 수확 후 손실을 줄이기 위해 냉장창고, 냉장차, 출하 순서를 함께 잡는 구조",
    "시장 자리: 노점, 하역, 입구 동선, 차량 진입, 창고 위치까지 포함된 시장 내 실질 권한",
    "그림자세: 마칼리 라인이 보호비, 통행료, 운송비, 연료비 명목으로 걷는 비공식 비용",
    "학교 급식 계약: 도시의 일상을 붙잡는 장기 계약이자 민심·조례·행정 영향력의 교차점",
    "개발금융: 관정, 냉장, 가공, 도로, 항만 같은 인프라 확장에 붙는 공적·준공적 금융 라인",
    "농업특구: 수매, 가공, 항만, 세제, 물류, 조달이 한 구역에서 묶이는 후반 확장 구조"
  ],
  "scene_details": [
    "루곤도 복귀 첫날, 폐 NGO 시범농장 울타리와 dead well 도면을 다시 확인하며 한국에서 왜 안 통했는지와 여기서 왜 통할 수 있는지를 동시에 떠올리는 장면",
    "밤중 총격 직후 모세 카반다를 살려내고, 아침에 펌프 반입선과 30일 비개입 유예를 같은 장면 안에서 회수하는 장면",
    "조셉과 함께 녹슨 펌프, 배관, 관정 수심을 확인하고 dead well에서 첫 물이 올라오는 공개 proof 장면",
    "남는 물과 못난이 작물을 나눠 주며 짐꾼, 노점상, 아이들, 오토바이 기사들이 도윤 이름을 생활권 안에서 퍼뜨리는 장면",
    "그레이스가 급한 공급 공백 때문에 도윤의 첫 시험 납품을 받되, 조건은 품질과 시간 준수뿐인 냉정한 거래 장면",
    "육묘장과 수매표가 처음 열리며 소농들이 마칼리 그림자세와 도윤 공개 수매표를 비교하는 장면",
    "냉장창고, 급수표, 경찰 협력, 우물 조례, 학교 급식 계약이 하나씩 제도 영수증으로 붙는 도시 운영 장면",
    "피터와 에스더가 장부, 조례, 허가, 세금표를 정리하고 시청이 도윤 농업망을 물가 안정 카드로 보기 시작하는 장면",
    "나탈리가 국제기구와 투자자 문서를 번역하고, 바라카 항만 시험선과 권역 수매망이 처음 맞물리는 장면",
    "국가급 위기에서 장관들이 도윤을 자기 라인으로 끌어들이려 하지만, 도윤이 누구의 사람이 아니라 시스템을 요구하는 장면"
  ],
  "notes": "opening 2~6 ledger와 ARC-01~04 하드 락이 이미 선명해서 Phase0와 opening TR은 현재 재료만으로 안정적으로 생산 가능하다. 특히 Block 1~10은 dead well, 시장 바닥, 첫 납품, 육묘장, 수매표, 운송 전쟁까지 receipts가 분명하다. 아직 비어 있는 재료는 카상가 시청 조직도, 주지사 라인의 구체 권력지도, 항만 수출 단가, 농업채권 구조, 특구 세제와 개발금융 세부 조건이다. ARC-05~07은 conservative expansion으로 밀되, 초반 receipts보다 scale이 먼저 커지면 안 된다. 오염 방지 핵심은 '문명화'가 아니라 급수표, 수매표, 허가, 장부, 학교 급식 계약 같은 실체가 도시를 굴리기 시작하는 장면을 유지하는 것이다."
}
